RecipeID,Name,TimeRequired,Instructions,Portions,Cuisine,DishID
709,Pizza Dough and Sauce,30,"In a large bowl, sprinkle yeast over warm water (I add a pinch of sugar and allow to set until it begins to foam, about 5 minutes., Stir in salt, oil and half of flour. Gradually add remaining flour, mixing well., Knead 8-10 minutes or until smooth and elastic. Place in greased bowl and let rise until double (1/2-1 hour Punch down and let rise again until double. Punch down and divide. Pat out on two pizza pans., Top with pizza sauce & toppings. Bake at 400 degrees for 20-25 minutes., 
Pizza Sauce:  Mix all ingredients together, blending well. (You can also add a few sprinkles of garlic powder if you want., Makes enough for two 12- or14-inch pizzas or one thick 16-inch pizza., Top with meats, cheese and other toppings., To freeze, prepared pizza method: double wrap and freeze the prepared pizza (without baking it on the pizza pan. Unwrap and bake the frozen pizza at 400Â°F for about 22 minutes., Alternative freezing method: after first punch down of dough, divide dough and place in a zip-loc bag and place in the freezer. To prepare, remove from freezer and place in a greased bowl. The dough will take about 8-10 hours to thaw and raise slightly. Pat out on grease pizza pan and proceed as directed above. I also freeze half the sauce in a small container for future use.
",16.0,International,709
710,Pizza Loaf,30,"Brown the meat and onion., Season with  oregano, salt and pepper., Stir in cheese  spread, egg and grated  cheese from pizza mix., Combine well., Mix pizza dough as  directed., Knead on well floured surface until no longer sticky., Roll dough into 12 x 14-inch size. Place on cookie sheet.  Spread filling over dough., Fold dough over and roll up., Pinch  edges together to form a loaf., Brush on melted butter  and  sprinkle with parsley flakes or herbs from pizza package.  Bake for 15  minutes at 450 degrees., 
Slice and serve with  pizza sauce.                       - - - - - - - - - - - - - - - - - -",1.0,International,710
711,Plum Cake,30,"Mix flour and sugar, and cut in butter with a pastry blender., Add one egg, and  stir with a fork until blended., Pat into a 9\ quiche pan and sprinkle with  chopped nuts., Place halved plums on top., Beat together two eggs, sour cream and  sugar., Pour filling over plums., Bake at 350 for 1-1/4 hours, then brown at 375  for 10 minutes.",6.0,International,711
712,Potato Appetizers,30,"Peel and chop potatoes., Place potatoes in a pot and cover with water., Boil until soft. Mash cooked potatoes with oil, then add seasonings., Meanwhile, heat oven to 375 degrees., Shape mix into 1-inch balls., Mix the paprika and wheat germ together in a dish., Roll potato balls in paprika and wheat germ mixture until coated., Place on oiled baking sheet. Bake at 375 degrees for about 20 minutes., Let stand on folded paper towels before serving with toothpicks.",8.0,International,712
713,Potato-Plum Dumplings,30,"Scrub potatoes well but do not peel., In a saucepan combine potatoes and water  to cover and bring to a boil., Cook until potatoes are tender when pierced with a fork (about 40 minutes; drain., When potatoes are cool enough to handle, peel  and, while still warm, press through a potato ricer into a large mixing bowl., Let cool., Add salt, eggs, and the 1 tablespoon butter to potatoes and mix well., Gradually mix in the 1 cup flour and farina until dough is easy to work, adding  more flour if it is too wet. Turn dough out onto a floured board and knead well  until smooth and fairly soft (5 to 10 minutes. With your hands form dough into  a large sausage-shaped roll., 
Cut roll into 12 to 16 equal pieces., Cut open plums and remove pits., Replace each pit with a sugar cube and re-form plum., With a floured rolling pin, roll out each dough piece into a 3-inch square 1/4 to 1/3 inch thick., Place 1 plum in center of each square. Bring up corners  of square to enclose plum completely; no part of plum must be exposed., Pinch  dough edges together firmly so that dumpling doesn't break open during cooking., Meanwhile, fill a large saucepan with water and bring to a boil over high heat. Drop in dumplings, being careful not to crowd pan, and boil gently, stirring  occasionally., 
Do not boil too hard or dumplings may split open., Once dumplings  rise to surface, cook until tender (5 to 10 minutes total cooking time,  depending on intensity of boil. With a slotted utensil carefully remove  dumplings one at a time to a heated bowl; cover tightly to keep warm., Repeat  with remaining dumplings.While dumplings are cooking melt the 1/2 cup butter in  a small skillet over medium heat. Add bread crumbs and cook, stirring, until  browned., Turn out onto a flat plate. Roll hot dumplings in browned bread crumbs  to coat completely and serve immediately., 
Variations:  Potato Noodles - Omit plums and sugar cubes., Prepare dough as directed, but  roll with your palms to form 2 or more sausage-shaped rolls about 1/2 inch in  diameter., Cut rolls into 2-inch lengths., Fill a large saucepan with salted water and bring to a boil over high heat.  Drop in noodles and cook until tender (5 to 10 minutes.  Drain and roll in breads crumbs as directed for dumplings., Dessert Potato Noodles Prepare Potato Noodles and roll in bread crumbs as  directed., 
Sprinkle with ground cinnamon and sugar to taste.  Yield: 14  servings.",14.0,International,713
714,"Great Northern Bean, Ham and  Vegetable Chowder",30,"Soak beans overnight in water to cover by 2 inches., Drain beans., Add water to cover beans by 1 inch., Cook beans with ham hocks (I use a  ham bone with some meat for at least 2 hours on low heat.  Remove ham  bone from beans and let cool., Add all other ingredients., Remove ham from  the bone and return ham to the bean mixture.  Cook until vegetables are  tender, about 30 minutes to 1 hour., Freezes well., Note:  I submitted this to a family cookbook and it is the recipe that  \everyone\ loves.
",8.0,International,714
715,Pumpkin Apple Pie,30,"In a saucepan, combine brown sugar, cornstarch, cinnamon and salt. Add water and butter; bring to a boil., Add apples., Cook and stir for 4 minutes., Place pastry in a 9-in., pie pan; add apple mixture. In a bowl, whisk pumpkin, milk, sugar, egg, cinnamon and salt until smooth; pour over apple layer., Bake at 3750 for 50 - 55 minutes or until a knife inserted near the center comes out clean., If necessary, cover the edges with foil for the last 15 minutes of baking time to prevent over-browning., 
Cool completely., Garnish with whipped cream.",4.0,International,715
716,Pumpkin Citrus Syrup Cake,30,"Grease a deep 23cm round cake tin, line the base with baking paper., Cream butter, rinds and sugar until light and fluffy, add egg yolks; beat until combined., Stir in half the sifted flour with half the cold pumpkin, then stir in the remaining flour and pumpkin., Beat the egg whites until soft peaks form, fold through the cake mixture.  Spread mixture into cake tin., Bake in a moderate oven about 1 hour or until cooked when tested with skewer., Pour hot syrup over hot cake and let stand 10 minutes before turning out onto a rack to cool., 
To make syrup:-  Combine all ingredients in saucepan., Stir constantly over heat without boiling until sugar is dissolved., Bring to boil, reduce heat, simmer 2 minutes without stirring.",12.0,International,716
717,Pumpkin Scones,30,"Preheat oven to 350 degrees., Lightly grease cookie sheets., Combine flour, baking powder, baking soda, spices and salt. In a large bowl, cream together shortening and brown sugar., Beat in the pumpkin, yogurt and sour milk., Gradually blend in  the dry ingredients., Turn the dough out onto a floured surface, sprinkle with  flour, and knead until smooth., Roll out the dough to a thickness of 3/4\., Using  a sharp knife, cut 2\ squares and place 1\ apart on baking sheets., Bake for  12-15 min., or until lightly colored., 
Transfer to wire racks, cover with a clean towel, and let cool.",48.0,International,717
718,Puppy Chow Snack Mix,30,"Melt chocolate chips, butter & peanut butter over medium heat. Stir to blend., Pour over Crispix in large bowl., Pour confectioners sugar in paper grocery bag., Add Crispix and shake vigorously until it breaks apart.  Serve in new doggie dish.",4.0,International,718
719,Beef & Pork Meatloaf & Onion Gravy,30,"Preheat oven to 350 F., Mix all ingredients together., Shape into a loaf pan., Bake for 1 1/2 hours., If desired, spoon onion gravy over baked meatloaf  slices., Onion Gravy Makes About 2 cups While this sauce was designed to be served on our Beef and Pork Meatloaf, it  is amazingly versatile. Try it on mashed or baked potatoes, pork chops, steak  or whatever! Use your imagination., Saute onion in butter for about 3-5 minutes, or until slightly browned., Stir  in flour and add remaining ingredients., 
Simmer for 3-5 minutes, stirring  constantly.",8.0,International,719
720,Raised Waffles,30,"* Flour may be any of or any combination of white, whole wheat, rye, oat, buckwheat, yellow cornmeal, or blue cornmeal., Put the 3/4 cup water into a large bowl and  sprinkle in the yeast and sugar.  Let dissolve for  5 minutes., Add the 2 1/2 cups water, the milk, butter, salt,  and flour(s to the yeast mixture and whisk until smooth and blended., Cover the  bowl with plastic wrap and let stand overnight at room  temperature. (The  batter will rise to double its  original volume.  Before baking the waffles,  beat in the eggs, then add the baking soda and stir until well combined., 
(The  batter will be thin.  Pour 1/2 to 3/4 cup batter into a very hot waffle iron and  bake until golden and crisp.  Serve immediately with the warm syrup., Variation:  Top with fresh strawberries and whipped cream or sliced bananas, toasted coconut, and sliced roasted almonds.  Dust with confectioner's  sugar.",8.0,International,720
721,Raisin Cream Pie,30,"Add raisins to water in saucepan and simmer 5 minutes., Beat egg yolks, sugar, vinegar and flour until light and creamy., Slowly add to raisins., Cook, stirring constantly, until filling is thick, 4 to 5 minutes., Remove from heat, stir in butter and cool until lukewarm., Pour raisin mixture into pie shell and top with meringue., Perfect Meringue., Have egg whites at room temperature to obtain greatest volume. Place in medium bowl with cream of tartar, salt and vanilla., Beat with electric or hand beater, at medium speed, until entire mixture is frothy., 
Do not beat until eggs stiffen., Add sugar, a little at a time, beating well after each addition., Do not under beat. Beat until sugar dissolves to help prevent beading., To test, rub some of meringue between your fingers to see if it is still grainy., (The grains are undissolved sugar Continue to beat until stiff, pointed peaks for when beater is slowly lifted., Place spoonfuls of meringue around edge of pie filling, spreading it so it touches inter edge of crust to seal all around., 
This prevents shrinkage. Pile remainder of meringue in center of pie and spread to meet meringue around the edge. If filling is not covered completely, the oven heat may cause it to weep., Lift up meringue over pie in points with back of teaspoon., Bake in moderate oven (350 F 12 to 15 minutes, or until meringue peaks are golden brown., Too long baking may cause weeping., Cool gradually away from drafts.",8.0,International,721
722,Sour Cream Raisin Pie,30,"Cook all filling ingredients in sauce pan on top of stove until mixture thickens and foam disappears., Use a large pan for this as the vinegar and soda will foam up., Turn into unbaked pie crust and top with second crust., Brush top with milk and cut slits to vent., Bake at 425 degrees for 20 min and then reduce oven temp to 350 degrees and bake for another 20 to 30 minutes or until brown.",8.0,International,722
723,Red Pepper Spoon Bread,30,"Preheat oven to 350., Spray a 1 quart baking dish with cooking spray., In a  medium size saucepan, stir together the broth, milk, sugar, salt and cornmeal,  then bring to a boil over moderate heat.  Add 2 tsp of the butter and cook the  mixture over low heat, whisking occasionally, for 5 minutes., Transfer to a  large bowl and stir in the cayenne pepper and nutmeg., In a nonstick skillet, cook the sweet red pepper and onion in the remaining 2  tsp of butter over moderate heat for 3 minutes or until softened, stirring  occasionally; add the corn and cook the mixture, stirring, 1 minute more.  Stir  into the cornmeal mixture.  In a small bowl, whisk the egg yolks with the baking powder, then stir them into the cornmeal mixture. Beat the egg whites until stiff but not dry., 
Stir 1/4 of the whites into  cornmeal mixture, then gently fold in the rest.  Pour the mixture into the  prepared baking dish and bake for 40 minutes or until puffed, then broil 4\ from the heat for 1 to 2 minutes or until golden brown., Serve at once directly from  the dish.",6.0,International,723
724,Rice Case for Quiches or Pies (Gluten-Free),30,"Combine all and pat over the base and sides of a lightly greased pie dish., Bake at 210 C for 15 minutes., Fill with your favourite fillings and bake as usual., Serve at room temperature. Cheers, Doreen Doreen Randal,  Wanganui., New Zealand.",4.0,International,724
725,Rice-Bacon Pineapple Salad,30,"Gradually add the rice to a large quantity of boiling salted water; boil rapidly for 12 minutes, then drain well., Spread on a tray and separate the grains with a fork to allow each grain to dry perfectly., Fry the bacon and onion; sprinkle over the rice.  Toast the almonds in a pan until golden brown., Put the rice, cucumber, almonds, capsicum and pineapple in a salad bowl., Add French dressing and toss lightly., Refrigerate until serving time. Cheers,  Doreen Doreen Randal,  Wanganui., 
New Zealand.",4.0,International,725
726,Roasting Peppers,30,"I put them under a hot grill and turn them infrequently until black all over., I then put them in a pot with a well fitting lid to cool. (The books often say put them in a plastic bag, but I try to minimise my use of plastics for environmental reasons, Once you can handle them you can peel off the black skin easily. Don't run them under the tap as much of the flavour can go.",1.0,International,726
727,Rock Candy for Kids,30,"Put one cup of water into a small saucepan, pour 2 cups of granulated sugar into the water, heat the water and sugar on the stove over a medium heat, continue  stirring until the sugar melts, keep adding sugar and stirring until it melts,  stop adding sugar when you see that it will no longer dissolve in the water  (that is until you see sugar lying on the bottom of the saucepan. Remove the  pot from the stove, let the liquid cool until it is just warm., Pour the liquid  into a clean glass jar., 
Tie one end of a piece of heavy cord around the middle  of a pencil., Place the pencil over the top of the glass jar letting the cord  fall into the liquid., Crystals will begin to form in a few hours The next day,  remove the cord from the jar, pour the sugar liquid back into the saucepan,  reheat and cool it just as you did before. Pour the liquid back into the jar and reinsert the cord with the crystals into it. More crystals will form., If you  repeat this procedure every day the crystal candy will grow bigger and bigger., 
When it has reached a size that pleases you, snip   off any excess string and  enjoy.",1.0,International,727
728,Rum Baked Beans,30,"Chop onion and saute until soft., Combine with all the other ingredients, including a little of the water from cooking the beans., Bake, covered at 350F for 45 minutes to 1 hour.",6.0,International,728
729,Bread Machine Sage-Wheat Bread,30,"Add all of the ingredients to a bread machine according to the manufacturer's  directions., Bake the bread using the wheat, regular, or white setting.",16.0,International,729
730,Beef Crumble,30,"TOPPING 3/4 cup wholemeal flour 1/3 cup rolled oats 1 oz butter 1/3 cup grated cheese 1/2 tsp dried mixed herbs Fry mince over a medium heat in its own fat, turning, until evenly browned., Add the onion, celery, mushrooms and carrot and fry for 5 minutes., Stir in the flour and cook a further minute.  Add the stock, sauce and salt and pepper to taste.  Bring to the boil, stirring., Cover and simmer 30 - 40 minutes., To make Topping:- Place the flour and rolled oats in a bowl., Rub in the butter until mixture resembles coarse breadcrumbs., 
Stir in the cheese, herbs and salt and pepper to taste.  Transfer the meat to a greased casserole and spoon topping over., Bake at 375 F for 20 - 30 minutes.",4.0,International,730
731,Salsa,30,"Combine all the ingredients and chill for 2 hours before serving with chips., The Cilantro is very important to this dish.",4.0,International,731
732,Salty Milk Biscuits,30,"Sieve flour and salt and rub in the butter., Gradually mix with milk to make a stiff dough., Roll out VERY thinly, brush lightly with beaten egg  or milk and sprinkle with salt., Bake 400 F for 10 - 15 minutes., Cheers, Doreen Randal,Wanganui,New Zealand.",4.0,International,732
733,Savoury Bread Dish,30,"Take slices of sandwich bread and put thick sliced cheese on three of them and spread with mustard., Top with the other slices and cut into quarters., Stand these in a greased ovenproof dish., Sprinkle with a tsp of garlic salt.  Beat together eggs and milk, pour over the bread making sure all the bread is dampened., Cover and leave to stand at least 30 minutes, spooning milk over the exposed bread every now and then., Cook uncovered at 190 C 30 - 45 minutes, depending on the depth of the dish, until crisp and golden brown and centre is set. Cheers,  Doreen Doreen Randal,  Wanganui., 
New Zealand.",4.0,International,733
734,Scottish Scones,30,"Heat oven to 375 degrees., Lightly grease cookie sheet. In med., bowl, combine  flour, oats, brown sugar, baking powder, salt and cinnamon; mix well., With  pastry blender or fork, cut in butter until mixture is crumbly., Add milk all at  once; stir just until dry ingredients are moistened., On floured surface, gently  knead dough 5 or 6 times., Place on greased cookie sheet; press into a 6\ round,  about 1\ thick., Brush top with melted butter., In small bowl, combine sugar and  cinnamon; mix well., 
Sprinkle over top., Cut into 8 wedges; separate slightly., Bake for 20-30 minute., or until golden brown., Serve warm.",8.0,International,734
735,Beef Enchiladas,30,"To prepare enchilada sauce, in medium saucepan, combine sauce ingredients., Simmer 30 minutes., (Cast iron skillets work well for following  To prepare beef filling, in large skillet, cook ground beef and onion  (you may sprinkle with additional chili powder and drain., Add 3/4 cup  enchilada sauce to meat and cook low 10 minutes or until sauce absorbed., To assemble enchiladas, in ungreased skillet, heat each tortilla low  heat, ~15 seconds per side, dip in sauce, fill with ~2 Tbsp beef   filling and roll up., 
Place seam side down in 12 x 8 inch baking dish., Cover enchiladas *evenly* with remaining sauce. Sprinkle with cheeses and   bake uncovered at 350 for 30 minutes.",4.0,International,735
736,Slow Cooker BBQ Pinto Beans,30,"Combine first 4 ingredients in an electric slow cooker on low heat. Cover and cook about 7 hours or until beans are tender., Drain cooking liquid., Stir in remaining ingredients., Set on high heat and cook uncovered 10-15 minutes, or until heated through.",6.0,International,736
737,Snow Flurry Brownies,30,"In a bowl, whisk together sugar, butter, eggs and vanilla., Combine flour, cocoa, baking powder and salt; add to sugar mixture and mix well., Stir in vanilla chips and nuts., Spread into a greased 8-in. square baking pan., Bake at 35O°F for 25-30 minutes or until a toothpick inserted near the center comes out with moist crumbs (do not overbake. Cool on a wire rack., Cut into diamond shapes if desired or garnish with melted white chocolate.",4.0,International,737
738,Soft Zucchini Spice Cookies,30,"In a mixing bowl, cream the butter and brown sugar; add the egg and mix well., Combine the dry ingredients; add alternately with milk to creamed mixture. Stir in zucchini, nuts, raisins, and orange peel., Drop by teaspoonfuls 2 inches apart onto greased baking sheets., Bake at 350°F for 12-14 minutes or until edges are lightly browned and cookies are set., Makes about 4 dozen.",4.0,International,738
739,Solo Chicken Breast and Rainbow Rice,30,"In the afternoon, or at least one hour before making the dish, combine the olive oil,juice. Place chicken breast  in a plastic bag and add olive oil  juice  mixture then refrigerate for at least an hour., Make sure that the marinade  coats the meat.  The rest of this process should only take 20 minutes if the  steps are followed in order., Remove the chicken and place on a hot grill (  total cooking time will be  20 minutes. and immediately proceed to the next  step., Add the water to the rice and place in a covered pan over a stove burner  with a very low flame.( total heating time will be 15 minutes.   After the chicken and the rice have cooked for 10 minutes; turn the chicken  breast over., 
Chop the onion and peppers and set aside.  After the chicken and  rice have cooked for another 5 minutes, turn off the flame under the rice, but  do NOT remove the cover., Heat up a small amount of butter and/or olive oil in a  frying pan; heat the onion and bell peppers  until soft.  After the chicken has  cooked for an additional 5 minutes ( 20 minutes total remove from the heat.  Remove the cover on the rice and stir in the heated onion and bell pepper., Pour  the rice mixture on a plate and place the chicken breast on top., 
Salt ( I like  lemon salt and pepper to taste.",1.0,International,739
740,Some 'Berry' Good Fruit Dip Ideas!,30,"Beat all ingredients together, adding more orange juice if needed to thin sauce. Makes 2 cups., Fruit Dip: 1 cup plain yogurt 3 tbsp. icing sugar 1/2 tsp. grated lemon peel Stir ingredients together. Makes 1 cup., Caramel Fruit Dip: 1 cup sour cream 1 tbsp. brown sugar 1 tbsp. Kahlua Combine all ingredients. Add more brown sugar if you want to omit Kahlua. Makes  1 cup., Chocolate-dipped Fruit: 2/3 cup semisweet chocolate chips 1 tbsp. parowax (cut into bits to measure Heat chocolate chips and wax in top of double boiler or pan over hot water. Stir until smooth and remove from heat. Return mixture to heat as chocolate cools.  Dip fruit (strawberries, Mandarin orange slices, pineapple chunks, clusters of  seedless grapes into mixture, covering about 2/3 of each piece. Place on  undipped end to cool or lay on a piece of waxed paper. Chill until about one  hour before ready to serve, when fruit should be placed at room temperature. HINT: The drier the fruit, the better the results.
",4.0,International,740
741,Spaetzle,30,"Using an electric mixer, blend the eggs, lard or oil, water and milk., Stir the  flour together with 1/2 tsp of the salt and the baking powder in a dry bowl., Blend this mixture into the liquid., Mix well and set aside for a moment. Bring 4 quarts of water to a boil and add 2 tsp of salt. Using a spaetzle maker  or spaetzle press squeeze the dough into the boiling water., Use about 1/3 of the dough for each batch., When the dumplings float to the surface, they are done.  Remove them with a slotted spoon and place in a colander., 
They can be served  with way with paprika gravy or pan fried with a little butter, just until they  are a bit golden, and topped with parsley., Note: These dumplings can also be made by using  piping bag or dropping very  small amounts from a spoon., The latter takes much longer.",4.0,International,741
742,Spaghetti Pie,30,"Cook spaghetti for 10 to 12 minutes or until tender but still firm., Drain well., Return spaghetti to saucepan., Stir in egg and Parmesan cheese.  In a medium  skillet, cook ground beef, onion, green pepper, garlic and fennel till meat is  browned and onion is tender., Drain fat.  Stir in tomato sauce and oregano; heat through., Spray a 9\ pie plate with nonstick cooking spray., Press spaghetti  mixture onto bottom and up sides of pie plate, forming a crust.  Spread cottage  cheese on bottom and up sides of crust.  Spread meat mixture over cottage  cheese.  Sprinkle with mozzarella cheese.    Bake 350 for 20 to 25 minutes or  till bubbly.
",6.0,International,742
743,Spicy Bacon &amp; Tomato Brunch,30,"Cut the bacon into small strips and add to saucepan., Cook over medium heat., Finely chop the onion and garlic; add to saucepan and fry with ginger until soft and translucent (not brown., When vegetables are cooked, open tomatoes and cut into small pieces; add tomatoes and juice to saucepan with salt and pepper., The secret of this recipe is to keep cooking over a medium heat, stirring occasionally, until the tomato juice has reduced to a thickish sauce., When desired thickness is reached, serve on toast -- it certainly wakes those taste buds up.
",4.0,International,743
744,Spicy Cherry Glazed Chicken,30,"Place oil in bottom of 13x9\ baking pan; spread to coat bottom., Arrange chicken in pan; set aside. In small saucepan, combine apple cherry juice concentrate,  honey, salt, cinnamon, red pepper and all spice; mix well., Bring just to a boil over medium-high heat.  Remove 1/2 cup sauce from pan; set aside.  Pour  remaining sauce evenly over chicken in baking pan., Bake at 350 for 40 to 50  minutes, or until chicken is cooked through, turning once. Remove chicken to  serving dish; keep warm., 
Pour pan drippings into reserved sauce; stir in dried  cherries, water and cornstarch., Bring to a boil over medium-high heat; cook 1  to 2 minutes, or until sauce is thickened, stirring frequently., To serve, pour  sauce evenly over chicken.",6.0,International,744
745,Spicy Dill Dip,30,"Blend all ingredients in a bowl, and season to taste with salt and pepper., Chill., Makes 1 cup of vegetable dip.",4.0,International,745
