RecipeID,Name,TimeRequired,Instructions,Portions,Cuisine,DishID
213,Twice Baked Potatoes,30,"Heat oven to 400 degrees Fahrenheit., Scrub potatoes; prick several times with a fork., Place in oven; bake 50 to 60 minutes until potatoes feel soft when squeezed., Remove and cool 15 minutes; half potatoes length wise (carefully., Using a small spoon scoop out pulp into a large bowl, leaving a 1/4 inch thick shell., Save the best 8 shells., Freeze the remaining shells for French fries or stuffed potato skins., Simmer milk and butter until butter melts., Pour over potato pulp and mash or beat until almost smooth., 
Add egg, half of cheese,salt, pepper and nutmeg., Mash until almost smooth., Fill shells using about 1/3 cup mixture per shell., Sprinkle with chives or green onion, remaining cheese and a little paprika., Reduce oven heat to 350 degrees Fahrenheit., Place shells on cookie sheet., Bake for 30 minutes until puffed and brown.",4.0,International,213
214,Spiced Pear Butter,30,"Combine pears and apple juice in a large Dutch oven., Tie broken cinnamon  spices, gingerroot, allspice and cloves in a piece of cheese cloth; add  to pear mixture. Bring to a boil; cover, reduce heat, and simmer for 45  minutes to 1 hour or until pears are tender., Drain pears, and discard  spice bag., Mash pears or process in food processor until smooth., Return  pear puree to Dutch oven, and add sugar., Cook, uncovered, over medium  heat for 30 to 40 minutes or until mixture thickens, stirring frequently., 
Remove from heat, and quickly pour hot pear mixture into hot sterilized  jars, leaving 1/4-inch headspace; wipe jar rims., Cover at once with  metal lids, and screw on bands., Process in boiling water bath for 5  minutes.",4.0,International,214
215,Lemon Curried Lamb Chops,30,"Combine lemon juice, curry powder, salt and sugar., Brush mixture over the chops and let stand for 2 hours to absorb the flavors., Heat the  butter in a frying pan, cook until golden brown on both sides.",4.0,International,215
216,Lemon Mint Lamb Chops,30,"Grill chops until tender., While chops are under the grill, prepare the sauce:, Melt butter in pan; add finely chopped onion, saute until tender., Add lemon rind, lemon juice, sugar and mint, heat gently., Spoon over hot chops., Cheers, Doreen Doreen Randal, Wanganui, New Zealand.",4.0,International,216
217,Winter Pear Butter,30,"Peel, quarter and core the pears; chop in 1/2-inch pieces., Put all the ingredients in a large heavy pot; bring to a boil., Reduce the heat and cook, stirring often, for 15 minutes, or until the  pears are soft., Puree the mixture in a food processor or blender., Return the  puree to the pot., Cook uncovered over very low heat, stirring often, for 1 to 1-1/2 hours, or until the pear butter is very thick., Be careful not  to let it scorch., Remove from the heat., Stir the hot pear butter for a minute or two to release more heat., 
Spoon into clean hot jars, leaving 1/4 inch of space at the top of  each jar., Wipe the rim of each jar., Cover and allow to come to room  temperature. (You'll notice that the pear butter is a rather gray-green  color; this is the correct color., Label the jars and refrigerate for up to three weeks., (Remember: The label should include the name of the recipe and the  date by which it should be eaten. Be sure the recipient stores the pear butter in the refrigerator..",1.0,International,217
218,Meatballs in Cheese Pastry,30,"Process flour, pepper and butter until combined., Add cheese, process until mixture forms a ball., Knead dough on a lightly floured surface until smooth; cover and refrigerate 30 minutes., Roll pastry between sheets of greaseproof paper until 2mm thick., Cut into 4cm rounds, top each with a meatball., Fold pastry to enclose meatballs completely, roll into balls., Brush top with egg, sprinkle with seeds, place about 3cm apart on greased oven trays., Cover and refrigerate 30 minutes., 
Bake in a moderately hot oven about 15 minutes or until lightly browned; cool before serving., MEATBALLS:- Combine all ingredients in a bowl; mix well., Roll level teaspoons of mixture into balls., You can make three hours ahead of time and cooked balls freeze well.",8.0,International,218
219,Basic Habanero Sauce,30,"Saute onion and garlic until soft., Add carrots with a small amount of water., Bring  to a boil, reduce heat and simmer until carrots are soft., Place in a blender with the peppers; puree until smooth., Mix puree with vinegar and lime juice and simmer for 5 minutes., Seal in sterilized bottles/jars.  Makes 2 cups., You can also try: My recipe., I'm allergic to onions, so I make mine somewhat differently, 24-30 Habenero peppers, stemmed and chopped, 2 Tbsp Olive oil, 1 pound shredded carrots, 2 heaping Tbsp of chopped garlic (I get this at the market in a jar. I prefer  to use the water pack, but the garlic packed in oil works just as well, 1 cup apple cider vinegar, 1/2 to 3/4 cup key lime juice., 
Saute Garlic in oil until soft., Add carrots and stir-fry for a minute or two to  distribute the garlic well., Add enough water to come just short of covering the  carrots., Bring to a boil, and simmer until carrots are soft, and liquid is  reduced to about 1/2 of what you started with., Put carrot mixture and peppers into food processor and process until relatively smooth, adding vinegar and lime juice., Return to the stove and simmer 5 to 7 minutes., For smooth Tabasco style sauce, strain through cheesecloth (pressing out  all the liquid and bottle in sterilized bottles., 
For a thicker basting type sauce, bottle as is., Makes 8 or 9 ( 4 oz canning jars.",4.0,International,219
220,Greek Phyllo Seafood Rolls,30,"Squeeze the spinach with your hands to remove excess liquid., Put the spinach in  a large bowl with ricotta, feta, lemon zest, dill weed and pepper., Stir to mix  well., Heat the olive oil in a medium frying pan over medium heat., Add the onion and cook, stirring occasionally, until the onion is tender, 3 to 4 minutes., Add  the garlic and stir 20 to 30 seconds., Add the onion-garlic mixture to the bowl with the spinach; stir until well mixed., Stir in the shrimp and set aside., 
Preheat the oven to 375 degrees Fahrenheit., Separate 1 sheet of the phyllo dough; lay it on the work surface with the long side toward you., (Keep the stack of remaining dough covered with plastic wrap to prevent it from drying.., Lightly brush the sheet with a little of the melted butter; lay another sheet evenly on top., Lightly brush half of the top sheet with more butter; fold the other half over to make a rectangle 8 x 11 inches., Lightly brush with a little more melted  butter., 
Spoon a generous 1/4 cup of the filling along the bottom edge, leaving 1 inch of phyllo clear on all sides., Lift the bottom end of the sheet and fold it over the filling., Fold the sides over and press lightly; gently roll up., Set the roll seam-side down on a lightly greased baking sheet (you will need 2  baking sheets., Repeat to use the remaining filling and phyllo., Brush the tops  of the rolls with melted butter., Bake until golden, 25 to 30 minutes., Serve  hot or warm.",4.0,International,220
221,Ouzo-Marinated Greek Cheese,30,"Cut cheese lengthwise into four 1/2-inch thick pieces., Arrange in single layer in shallow dish., Mix ouzo, olive oil, parsley, thyme and pepper in small bowl., Pour over cheese., Marinate at least 4 hours and up to 8 hours, turning once., Preheat broiler., Remove cheese from marinade; transfer to 4 small broiler proof gratin dishes., Drizzle 2 teaspoons marinade over each piece of cheese., Broil until cheese is soft and just begins to melt, about 4 minutes., Serve with bread., 
Notes: This starter is an easy version of the fried cheese dish, saganaki, which is traditionally paired with a glass of ouzo., Serve with freshly grilled pita bread.",4.0,International,221
222,Greek Spinach Triangles,30,"* To cut calories, you can use butter-flavored cooking spray in place of the  butter., Cook spinach according to directions; drain well., Mix spinach, eggs, onion, cream cheese, pepper and feta cheese together., Refrigerate mixture at least 1 hour., Open package of phyllo pastry; cut a strip 2\ wide, cutting through all layers., Cover remaining dough with a damp cloth to prevent cracking., Separate dough so that you have 2 sheets for each triangle., Brush the dough with melted butter., 
Put 1 rounded teaspoon of spinach mixture at the top of the strip., Fold pastry over like folding a flag., Place on well-buttered baking sheet; brush top with butter., Bake at 375 degrees Fahrenheit  for 20 minutes., Serve warm., To freeze the triangles before cooking, butter both sides of triangle and wrap well., Bake when needed.",50.0,International,222
223,Grand Marnier Cake,30,"Cream sugar and butter., Add egg yolks and 1 teaspoon  Grand Marnier., Continue to beat. Sift flour, baking soda and  baking powder., Add flour to mixture with sour cream, beginning  and ending with dry ingredients., Add orange rind, walnuts and  stiff beaten egg whites., Butter and flour an angle food cake  pan., Bake at 350 degrees for 55 minutes., Spoon topping over baked  cake while still in hot pan., Cool and invert onto serving  plate.",8.0,International,223
224,Spanish Potato Omelet (Tortilla a la Espanola),30,"Heat the oil in a 8-9 inch skillet. Add the slices of potato one at a time to avoid sticking together., Alternate layers of potatoes with layers of onions., Cook slowly over medium heat, turning the potatoes until tender, not brown., Drain potatoes in a colander, save oil., Make sure skillet is very clean for later use.  In a bowl, beat eggs with a fork until slightly foamy., Salt to taste.  Add the potatoes, press down to cover potatoes completely with egg.  Return to skillet, heat 2 tablespoons of saved oil until smoking point.  Add the mixture, spread it out. Rapidly, lower the temperature to medium-high., 
Shake the pan often to avoid sticking., When the bottom is brown, cover the skillet with a plate, turn skillet up-side down, remove tortilla, slide off plate with uncooked side down into skillet and cook the other side, Turn several times until cooked",4.0,International,224
225,French Pecan Pie,30,"Beat egg whites until stiff but not dry., Gradually add sugar., Add vanilla, broken crackers and pecans., Bake in a 10-inch buttered pie pan for 30 minutes at 300 degrees Fahrenheit., Cool., Top with sweetened whipped cream (spread over cooled pie., Garnish with shaved chocolate.",8.0,International,225
226,Thai Coconut Chicken Soup,30,"Bring 1 cup coconut milk to boil., Add chicken, lemon grass, and Laos., Cover  and simmer til chicken is tender., Add remaining 1 cup coconut milk, green  onions and chilis., DO NOT BOIL., Stir in lime juice and fish sauce just before  serving.",4.0,International,226
227,Salt Cod Chowder,30,"Freshen salt cod by soaking it overnight in cold water to cover., Drain, place in a stewing pot, and cover with fresh water., Bring to simmer with low heat., Check to see if the fish is still too salty - if so, drain, add fresh cold water, and bring to simmer again, and drain., Fry salt pork in stewing pot until crisp; remove fried pork scraps and reserve for garnish., Cook onion in pork fat until tender., Add potatoes, carrots, water, salt, and pepper and cook covered for about ten minutes, or until vegetables are tender., 
Add corn or hominy, heated milk, and freshened salt cod., Bring chowder to a simmering temperature, but do not boil., Garnish with the pork scraps., Serve hot, with freshly baked home made bread or rolls and butter.",4.0,International,227
228,Thai Fried Bananas,30,"Peel bananas; slice lengthwise then in half., Fry in butter until soft and golden., Add sugar and stir until syrup thickens., Sprinkle with lime juice and serve.",2.0,International,228
229,Thai Beef Salad,30,"Tear romaine lettuce, red leaf lettuce, and Belgian endive into bite-size pieces., In small bowl, combine 2 tablespoons oil,  2 tablespoons lime juice, and 2 tablespoons soy sauce., Add beef strips; stir; marinate at least 1 hour at room  temperature., In food processor, combine 1/2 cup oil, 2 tablespoons lime juice, 1 tablespoon soy  sauce, ginger, brown sugar, garlic and jalapenos; puree., Reserve marinade., Stir-fry beef in 2 tablespoons oil until just browned., Mix reserved marinade with  dressing., 
Top greens with beef., Pour dressing into a wok; stir to heat; mix in beef juices., Pour hot dressing over salad., Add cilantro, tomatoes, and  green onions; toss.",4.0,International,229
230,Feijoada (Brazilian Bean Soup),30,"Sort and wash beans; place in a large Dutch oven., Cover with water to 2 inches above beans, and bring to a boil; cook 2 minutes., Remove from heat; cover and let stand 1 hour., Drain beans; set aside. Wipe pan with a paper towel., Heat oil in pan over medium heat. Add onion, kielbasa, and garlic; saute 10 minutes or until onion is tender., Add cumin, and saute 1 minute. Return beans to pan., Add water and next 3 ingredients; bring to a boil., Cover, reduce heat, and simmer 1 hour and 10 minutes or until beans are tender; remove bay leaf., 
Stir in vinegar and hot sauce.",15.0,International,230
231,Thai Coconut Custard,30,"Beat coconut milk, eggs, palm sugar and salt together., Cook in a double boiler, stirring constantly, until it resembles  soft scrambled eggs., Pour into a small casserole dish., Bake at 350 degrees Fahrenheit for 30  minutes., Brown under a broiler.",4.0,International,231
232,Feijoada (Brazilian Bean Soup) II,30,"Soak black beans overnight; drain., Preheat oven to 350 degrees Fahrenheit., Combine black beans, water, ham, pork loin, Italian sausage, cherry tomatoes, onion, red pepper flakes, garlic, and orange zest in a Dutch oven., Bring to boil, uncovered, on stove top., Cover and transfer to oven., Bake 90 minutes., Remove cover and bake another 30 minutes., Cool overnight in refrigerator., Remove fat and reheat.",4.0,International,232
233,Bean Curd With Broccoli,30,"Put cornstarch into a cup and slowly add 1/4 cup of the vegetable stock (make  sure it is room temperature or cooler and mix well., Add wine, soy sauce and  sesame oil., Mix well., Cut scallion into 1 1/2-inch lengths., Heat vegetable oil  in a wok over medium heat. When hot, put in ginger and garlic. Stir fry for 10  seconds., Put in scallion and broccoli., Fry for 1 minute. Add 1/2 cup vegetable  stock and the salt. Bring to a simmer., Cover and cook over a medium heat for a  minute, until broccoli is tender-crisp., 
Remove broccoli with a slotted spoon., Turn heat to low and add tofu., Let it heat through., Add cornstarch mixture.Stir  very gently., Put broccoli back in wok., Serve as soon as the sauce is thick and  everything is heated through.",4.0,International,233
234,Cauliflower and Potatoes,30,"Put oil, cumin seed and ginger in a large frying pan and cook over medium heat 3 to 5 minutes., Add cauliflower and potatoes., Add some garam masala and red peppers and mix., Cook over medium heat 7 to 10 minutes., Cover and reduce heat to low. The steam should cook the vegetables. If it seems too dry, add a little water.",4.0,International,234
235,Curried Vegetables,30,"Cook the cauliflower, carrots, celery, and onion in a small amount of water until crisp- tender-drain; set aside., Combine the soup, mayonnaise, salt, curry powder, coriander, and ginger in a mixing bowl; mix well., Stir in the vegetables., Spoon into an oven-proof casserole dish., Combine cheddar cheese, bread crumbs and melted butter., Sprinkle over the vegetables., Bake uncovered at 350 degrees Fahrenheit for 30 to 35 minutes.",6.0,International,235
236,Scrambled Tofu on Toast,30,"Crumble the tofu and fry it in the vegetable oil and butter until evenly cooked., Add the turmeric, herbs, and salt and pepper to taste. Saute a further few minutes., Serve on crispy wholemeal toast spread with butter., This is the basic recipe... you can also add grated cheese, fried mushrooms, sweet or hot peppers, onions, garlic, or anything you like to this mixture to make it to your taste!  Experiment and enjoy!",2.0,International,236
237,Crisp Sauteed Cucumbers With Lemon,30,"Peel the cucumbers if waxed., Cut cucumbers in half lengthwise; scoop out the seeds with a spoon., Cut them into inch chunks., If the cucumbers are not super-firm, place the chunks in a colander and sprinkle them with 1 tablespoon  of salt. Shake to distribute the salt. Let cucumber drain for about 20 minutes. Rinse and dry., If the cucumbers are already firm, proceed with the recipe., Remove a few strips of zest from the lemon with a zester or vegetable peeler; mince enough to measure 1 teaspoon., 
Cut the lemon in half through its equator and section it as you would an orange. Set the zest and lemon sections aside., Place  the butter or oil in a large skillet over medium high heat., Place about 2 cups flour in a bag, and, when the butter melts or the oil is hot, put a few chunks of cucumber at a time in the bag., Shake well; add cucumbers to the skillet., Repeat until all the cucumbers are used up., Cook over medium high heat, stirring and turning occasionally, for about 10 minutes, until the exteriors of the cucumbers are crisp and the interiors are tender enough to be easily pierced  with a thin-bladed knife., 
Add the lemon zest and lemon sections, along with salt and  pepper, and cook for 1 minute more., Garnish with parsley and serve.",4.0,International,237
238,Tutti Frutti Trifle,30,"Remove segments from membrane of grapefruit and orange; slice pineapple., Cut marshmallows and cherries into eighths., Soak marshmallows and coconut in maraschino juice., Beat egg whites until stiff and fold in sugar., Combine  with fruits and coconut marshmallow mixture. Freeze until firm., For an extra taste treat add 1 Tbsp of brandy or some people  like to add 1/2 cup of seedless raisins.",4.0,International,238
239,Creamed Cucumbers,30,"Peel the cucumbers if waxed., Cut them in half lengthwise and scoop  out the seeds with a spoon., Cut them into 3/4 inch chunks., If the  cucumbers are not super-firm, place the chunks in a colander and sprinkle  them with 1 tablespoon of salt. Shake to distribute the salt and let  them drain for about 20 minutes., Rinse and dry., If the cucumbers are  already firm, proceed with the recipe.  Place butter in a medium to large skillet over medium heat. When it  melts, add the onion and cook, stirring occasionally, until the onion  softens, about 5 minutes., 
Do not let the onion brown., Add the cucumbers  and cook, stirring for about 5 minutes, until the cucumbers are just  tender., Add pepper and, if you did not salt them earlier, salt.  Turn heat to low, then stir in the cream or yogurt and a good handful  of dill., Stir until well blended, then serve, garnished with more dill.",4.0,International,239
240,Virginia Fried Soft Shell Crabs,30,"Dress fresh crabs or thaw frozen crabs.  Rinse in cold water; drain., Combine eggs, milk, and salt., Combine flour and crumbs., Dip crabs in egg mixture and roll in flour/crumb mixture. For heavier breading, let crabs sit several minutes and repeat dipping/rolling procedure. Additional spices, such as cayenne pepper and garlic, may also be added., Place crabs in a heavy frying pan which contains 1/8 to 1/4 inch of fat, hot but not smoking., Fry at moderate heat. When crabs are brown on one side, turn carefully and brown the other side. Cooking time is approximately 8 to 10 minutes., 
Drain on absorbent paper.",6.0,International,240
241,Blue Jimmy Pillows,30,"In saucepan, combine chicken broth, vegetable oil, Worcestershire sauce,  parsley, season salt, celery seed, red pepper, and tarragon., Bring to a  boil, incorporate flour until blended., Once flour and ingredients are  combined set aside to cool., While that is cooling beat eggs to a fluffy  consistency., The reason for letting the flour mixture cool is so that it  doesn't cook  the eggs., Combine beaten eggs and flour mixture thoroughly., Incorporate  crab meat. After everything is combined, drop 1 large tablespoon per  serving onto ungreased cookie sheet, and bake at 425 degrees for 12 to 15  minutes or until golden brown.
",4.0,International,241
242,Apricot Salsa,30,"Cut a red bell pepper in half; remove seeds; and roast half of it. (Brush with olive oil; put under broiler very close to heat until blackened, about 5 minutes. Chop., Saute onion in about a tablespoon  of olive oil until translucent., Add tomato and jalapeno; saute about another 5 minutes, until tomato is cooked., Add apple cider to cover apricots and boil down until cider is almost all boiled off., Add chopped roasted bell pepper; stir., Add dark rum and flambe. (Light and swirl until flame goes out., 
Serve hot over grilled shark, swordfish, shrimp, or marlin.",4.0,International,242
243,English Trifle - Guy Attwood,30,"This recipe was given to me by my Grandmother who came over to America in 1895 from England. I have altered it slightly. As far as I know it is  relatively original, or as original as any type of recipe such as this can be. It is not only addictive and decadent but pretty to look at as  well. This is a special occasion dessert., Whisk yolks in a medium saucepan., Gradually add sugar, whisking until  mixture is thick and lemon colored, about 1 or 2 minutes., Blend in whole milk,  whipping cream and cornstarch; mix., 
Place over medium low heat and cook, stirring constantly, until mixture thickens, about 3 to 5 minutes. DO NOT BOIL  OR MIXTURE WILL SEPARATE., Remove from heat and stir until slightly cooled., Blend in vanilla and nutmeg., Transfer to a bowl; repeat process for the  two required for the trifle., ASSEMBLY:, Whip the cream as your MaMa or Daddy taught you to do., In your  prettiest large crystal bowl (salad bowl size place a little less than  half the whipped cream around the bottom and half way up the sides., 
Break 1/2 of the cakes into bite sized pieces and drop randomly all over the  cream., Drizzle sherry over all., Drop dollops of jam and slightly less  than half of the drained raspberries over the cake., Drizzle 1/2 of the  thick but liquid custard over all., Repeat for the next layer, reserving  some raspberries for the top., (Try to plan to end with a layer of jam and  raspberries as the top of the Trifle., Finally, completely cover the top  with the remaining whipped cream., Drizzle a little chocolate on top in any  pattern you think looks good., 
Add a few raspberries and stand back to receive raves., To serve, merely scoop down and place on a pretty  plate., NOTE: Make about 4 hours before serving. Cover with plastic wrap and  refrigerate.",8.0,International,243
244,Rote Gr&uuml;tze,30,"FOR DESSERT:, Combine raspberry juice, pureed strawberries and cherry juice in  1 quart measure., Add enough grape juice to total 1 quart., Pour mixture into  heavy saucepan (NOT ALUMINUM., Add 2 more cups grape juice., Stir in sugar, lemon zest, lemon juice., Bring to a boil, uncovered, over medium heat stirring often., Combine cornstarch with wine in separate bowl to make a thin, smooth  paste., As soon as mixture boils, add corn starch paste, whisking vigorously., Immediately reduce heat to low; cook and stir for 3 minutes until mixture boils again, thickens, and starch taste is gone., 
Stir in raspberries and cherries gently., Heat and stir 1 minute more., Remove from heat and stir 1 minute more., Cool mixture to room temperature., Chill for 24 hours., FOR TOPPING:, Shortly before serving, beat heavy cream with vanilla sugar until slightly thickened, but still thin enough to pour., Spoon Rote Grutze into stemmed goblets and top each with a generous ladle of whipped cream and serve.",8.0,International,244
245,Twice Baked Ham and Cheese Potatoes,30,"Bake potatoes at 400 degrees Fahrenheit for 1 hour until soft., Slice potatoes in half lengthwise., Scoop out insides, leaving a firm shell., Place potato pulp, cheddar cheese, milk, ham, sour cream, onion salt, pepper, and butter in a mixing bowl., Beat at high speed until smooth., Fill potato shells with mixture., Bake at 350 degrees Fahrenheit for 20 to 30   minutes., Garnish with paprika or parsley.",6.0,International,245
246,Rock Candy,30,"* Candy flavoring is carried by a lot of grocery stores, near the baking aisle with candy-making and cake decorating supplies., Bring the water to a boil in the saucepan., Remove from heat; add 3 cups of sugar, stirring until dissolved., Slowly add the remaining sugar, reheating the water if necessary., When all the sugar is dissolved, pour the mixture into 3 heat proof jars or glasses., Stir 3 drops of liquid food coloring and 1/2 teaspooon candy flavoring into each jar., Tie each length of string around a pencil., 
Lay one string on top of each jar so the strings hang down into the liquid., Crystals will begin to form in 1 hour, and continue to solidify for several days., If a layer forms on the surface of the jar, break it., When liquid completely evaporates, candy is ready.",4.0,International,246
247,Twice-Baked Sweet Potatoes,30,"Remove outer covering from garlic but don't separate the cloves., Wrap garlic in aluminum foil coated with cooking spray., Place garlic and sweet potatoes on a baking sheet., Bake at 400 degrees Fahrenheit for 1-1/4 hours., Separate garlic cloves; squeeze to extract 2 teaspoons pulp., Slice skin away from top of each potato and scoop out the pulp leaving   the shells intact., Mash potato pulp with garlic, sour cream, salt and pepper., Spoon into potato shells., Bake 400 degrees Fahrenheit for 15 minutes or until heated.
",6.0,International,247
