RecipeID,Name,TimeRequired,Instructions,Portions,Cuisine,DishID
455,Ginger Layer Dessert,30,"Drain the cans of fruit, reserving the syrup., Place one third of the gingernuts in a layer in the bottom of a 5 cup souffle dish and spoon over just enough of the syrup to moisten the biscuits., Arrange one third of the fruit on top and cover with a layer of cream., Repeat the layers twice and chill in the refrigerator., Decorate with chocolate vermicelli before serving., Cheers,  Doreen Doreen Randal,  Wanganui., New Zealand.",6.0,International,455
456,Gingerbread Yule Log,30,"In a mixing bowl, beat yolks on high until thickened, about 3 minutes., Beat in molasses and butter. In another bowl, beat whites until foamy;, gradually add sugar, beating until soft peaks form. Fold into yolk mixture., Combine dry ingredients; gently fold into egg mixture until well mixed., Line a greased 15x10x1 in. baking pan with waxed paper; grease and flour paper., Spread batter into pan. Bake at 375'F for 9-12 minutes or until cake springs back when lightly touched., Turn onto a linen towel dusted with confectioners' sugar., 
Peel off paper and roll cake up in towel, starting with short end., Cool on a wire rack, Meanwhile, beat the first five filling ingredients in a mixing bowl until soft peaks form., Unroll cake; spread with half the filling. Roll up., Spread remaining filling over cake., Sprinkle with cinnamon if desired.",10.0,International,456
457,Grandma's Banana Ice Cream,30,"Beat eggs and sugar together., Add next four ingredients to the ice cream maker and add enough homogenized milk to make 1 gallon liquid., Freeze in maker or churn until frozen following manufacturer's instructions.",18.0,International,457
458,Slow-Cooker Grape Jelly Meatballs,30,"Sauce: 13 ounce bottle Heinz Chili Sauce 5 ounce jar grape jelly dash Worcestershire sauce Combine first 4 ingredients in large bowl and mix well., Add enough breadcrumbs  to make meatballs the proper consistency; if the  mixture becomes too dry and  crumbly, add a little milk and  continue.  Season with salt and pepper., Form  into small  meatballs., Brown meatballs, a few at a time, in a large skillet  over medium- high heat.  If meat is very lean, you may need to add a bit of oil  to  your skillet.  Blend sauce ingredients and pour over meatballs., 
Cover and  simmer about 30 minutes, stirring occasionally     or,  transfer meatballs to a  crock pot, and cook on low for several hours  until done. Serve warm.",4.0,International,458
459,Gray Girls' Easy Chicken Fingers,30,"Cut chicken into strips., Dip chicken in the salad dressing and then in the smashed crackers!, Bake for 15-20 minutes at 400F.",14.0,International,459
460,Greek Chicken and Cucumber Sauce,30,"Combine marinade ingredients and pour over chicken., Marinate in the fridge for up to 24 hours., Remove chicken from marinade and grill over medium heat for 5 -7 minutes per side., Serve with rice, or oven roasted potatoes, and cucumber sauce., Makes 4 servings., Tip: The marinade can also be used on strips of chicken., After marinating, thread the strips onto skewers and grill for 5 - 7 minutes per side., CUCUMBER SAUCE:, In a strainer mix cucumber and salt and set aside for at least 15 minutes., 
Squeeze excess liquid from cucumber., Blend grated cucumber with remaining sauce ingredients and refrigerate until needed., Serve with Greek Chicken., Tip: If you don't have a strainer put cucumber and salt in a double layer of paper coffee filters., Gently squeeze the excess liquid out of the mixture.",4.0,International,460
461,Greek Mushroom Salad,30,"Heat the oil on low in a frying pan, then gently fry the mushrooms for 2-3 minutes., Do not overcook., Sprinkle in garlic and basil, then toss the mixture for a minute or two so that mushrooms are well coated., Add the tomato, lemon juice, water, salt, and pepper., Stir together and cook until the tomato softens., Remove from heat and let cool., Garnish with chopped herbs.",6.0,International,461
462,Greek Salad,30,"Boil potatoes in skins for 30 minutes., Drain, cool and cut into slices in a  bowl., Add peppers, onions and parsley., Fold in salad dressing and lightly  salt if wanted., Should be about 3 cups Salad ingredients needed 1 head of lettuce shredded, saving the good outer leaves 12 sprigs of watercress 2 tomatoes cut into 12 wedges 1 cucumber cut into 8 fingers 1 avocado cut into 8 wedges 4 portions of Feta cheese, blocks are good for slicing into squares 1 green pepper cut into 8 rings 4 slices of cooked beets (bottled is fine 4 jumbo cooked shrimp 4 anchovy fillets 12 Greek olives 12 Salonika peppers 4 radishes cut into rosettes 4 whole green onions Line platter or LARGE (this is a meal! bowl with the outside of the lettuce  leaves., 
Place the 3 cups of potato salad in a mound in the center of the  lettuce.  Cover with the remaining shredded lettuce, mounding it up high., Arrange the watercress on top., Place the tomato wedges around the bottom  outer edge of the lettuce.  Place the cucumber fingers in-between the  tomatoes standing upright on the lettuce.  Put avocado around the same way so  you have tomato, cucumber, avocado repeating all round., Place the 4 fetas  around  the top in a circle.  Add the beets on the feta and the shrimp on the beet.   Place the anchovy on top of the shrimp/beet/feta., 
Place the olives, peppers,  green onions as desired., This is a beautiful dish., You will see the empty  spots to fill., Dressing 1/4 cup white vinegar 1/4 cup olive oil  1/4 cup vegetable oil oregano   Blend the two oils., Sprinkle the entire salad with the vinegar then with the  blended oils., Sprinkle oregano all over., Serve immediately., If you want to  make it early  in the day, wait until serving time to do the feta, beet, shrimp, anchovy., The beet will stain the cheese.  We find it hard to destroy this work of art until we remember how wonderful  it is!! Serve with toasted garlic bread for a meal., 
Diane Pyburn",4.0,International,462
463,Green Death Tuna Sandwich,30,"Mix first five ingredients together., Toast whole grain bread., Top two slices with cheese followed by the tuna salad., Cover with remaining toasted bread., Variation: Green Death Tuna Melt. Fill two pieces of bread with cheese and tuna salad.  Butter the outsides of the bread and cook as for grilled cheese sandwiches.",2.0,International,463
464,Baked Creamed Potatoes,30,"Peel and chop potatoes, cook in boiling salted water until tender, drain well., Mash until smooth, mix with mayonnaise, sour cream, milk, lightly beaten eggs, mustard and parsley; season with salt and pepper., Press mixture though a sieve, spoon mixture evenly into a greased casserole dish., Sprinkle with grated cheeses., Bake in a moderate oven 20 - 30 minutes or until golden on top.",8.0,International,464
465,Grilled Bourbon Salmon,30,"Combine juice, soy, brown sugar, bourbon, pepper, garlic powder and oil in a bowl., Remove all skin from the salmon., Place the salmon in a glass dish side by side. Pour some of the marinade over (reserve some for basting while grilling. Refrigerate for at least 1 hour a few hours will be even better., Drain and grill over med.-high about 5-7 minutes per side or until fish flakes-basting with the reserved marinade.",4.0,International,465
466,Grilled Chicken & Veggie Pizza,30,"Coat chicken with salad dressing and barbecue over medium heat for 5-7 minutes  per side. Cool slightly and slice thinly., Barbecue red pepper until skin is  blackened on all sides., Put pepper in a plastic bag and close bag until pepper  is cool enough to handle. Remove and discard skin, seeds and core. Cut pepper  into strips., Slice zucchini lengthwise and slice onion into thick slices., Barbecue until softened., Cut zucchini into bite size pieces., Sprinkle 1 cup of  cheese over pizza crust and top with tomato slices., 
Arrange chicken and  vegetables on top and sprinkle with remaining cheese and fresh basil., Put pizza  on the barbecue, close the lid, and bake for 3 to 5 minutes or until the crust  is lightly browned and the cheese has melted., Serves 2 to 4 people.",4.0,International,466
467,Grilled Bell Peppers,30,"Take several bell peppers, cleaned of the stems and seeds.  Cut into strips lengthwise.  These can be four to six depending  on the size of the peppers and your preference., Season LIGHTLY with salt and freshly ground black pepper., Brush both sides of the strips with good olive oil., Place  skin side down on hot grill, until skin blisters and peppers soften   (3-8 minutes depending on grill. You can let the skin brown a bit if desired., Turn peppers and grill until inner side is done (about half the time of  the skin side -- 2-4 minutes., 
Try this with different color peppers.  Maybe add a few green onions., Try this with Anaheim peppers --  Very good!, Try adding sliced zucchini, too.",4.0,International,467
468,Grilled Pineapple and Bananas with Mango Sorbet,30,"Cut pineapples in half lengthwise, leaving top with leaves attached if you wish  to serve it the pineapple shell., Remove most of the pineapple from the halves,  in one piece if possible, using a paring knife and grapefruit knife.  Cut the  pineapple inside piece in half lengthwise and cut out the core.  Cut in half  lengthwise again and then cut each piece into 2., (You should end up with about  8 long slices from each pineapple. In a small bowl, combine brown sugar with  cinnamon and nutmeg., 
Toss half this mixture with the pineapple. Peel bananas  just before cooking, cut in half crosswise and lengthwise.   Toss with remaining sugar., Barbecue pineapple or broil until browned and partially cooked, about 8  to 10 minutes., Cook bananas until browned, about 5 minutes., Serve \sticks\ of  pineapple and bananas in pineapple shells with a scoop  of sorbet.  NOTE: If you are not serving it in the shells, buy the  pineapple already peeled and cored., It can be cut into rounds or sticks.
",6.0,International,468
469,Garlic Cauliflower,30,"Heat oil in a heavy nonstick skillet over medium high heat., Saute next 4 ingredients 2-3 minutes, stirring frequently., Add stock, cover skillet and cook another 3-4 minutes or until cauliflower is tender.",4.0,International,469
470,Garlic Greek Sauce,30,"Cut up the cucumber into very small pieces. Sprinkle them with a little salt, and let them sit for a few minutes. This will draw out excess moisture., Rinse them (but don't soak them to get off the salt. Crush the garlic and, mix it with the yogurt. If you like your sauce thick, drain in through a, cheese cloth and use only the thick stuff that remains. Finally, mix in the, cucumber. I like to add a lot of pepper and, at the last minute, a little, lemon juice.",4.0,International,470
471,Garlic Pizza Crust,30,"Dissolve yeast in water and add sugar., wait a few minutes., add oil  and salt  and garlic ., mix in 3 cups flour and whip about 10 min till it leaves the  side of the mixer bowl., add remaining flour w/ dough hook or by hand., knead  till  smooth., allow to rise twice in the bowl., punch down., (I rush this a bit oil  baking sheets .use fingers press out to edges., Makes 2 pizzas, cookie sheet size, let rise a bit and top., bake at  425*  20min.this is fantastic., crust smells slightly like garlic  bread., 
but is  notstrong., We usually make one cheese and the  other with ground., beef, ham,  onion and mushroom., Even the kids say it is the best crust so far., This makes  2 cookie sheet sized or 12 after school snack size I  form them in thebottom of  a cheapo pie pan, top and bake  completely and put them in zip bags.",4.0,International,471
472,Baked Breakfast Potatoes,30,"In a large bowl combine all ingredients except the corn flakes., Mix well and pour into a 9 X 13 inch casserole sprayed with non-stick cooking spray., Sprinkle crushed corn flakes on top., Bake at 350 degrees F or 45 to 60 minutes.",10.0,International,472
473,German Potato-Cheese Soup,30,"Peel and prepare vegetables., In a large cooking pot, add water, chicken broth,  chicken soup base, black pepper, carrots, potatoes, onions and bring to boil., Reduce heat and simmer for 15 minutes or until vegetables are tender; stirring  occasionally., Add celery, sweet red pepper and simmer for 5 minutes more.   Gradually add mayonnaise to hot soup, whisking until smooth., Reduce heat to  medium and add processed cheese, sharp cheddar cheese and Swiss cheese and  simmer for 5 minutes or until cheese melts and soup is creamy; stirring  constantly., 
Add instant mashed potatoes and stir well., Let soup sit for 15 minutes before serving., This soup is very rich, but good., Refrigerate any unused portion., Serves 12",12.0,International,473
474,Ginger Fried Chicken,30,"Add ginger, garlic, soy sauce, salt, and pepper to chicken, mix well, and  marinate overnight. Add eggs to chicken., Mix together well., Add flour to coat. Mix well., Fry until  golden, about 5 minutes., Finish in oven, 350 degrees for 30-35 minutes.",1.0,International,474
475,Gladys' Sweet Onion-Sausage Casserole,30,"Put onions in bottom of 12\ x 17\ Pyrex dish., Add Ritz crackers, then sausage meat., Add a layer of onions, cream of mushroom soup, salt, and seasoning salt., Sprinkle layer of cheese and pimento., Bake in preheated oven at 400F for 1 hour.",4.0,International,475
476,Golden Baked Fish,30,"Place fish in a greased 13-in X 9-in x 2 baking dish; sprinkle with pepper., Beat egg white with salt if desired until stiff peaks form., Fold in mayonnaise, dill and onion juice, spoon over fish., Bake uncovered at 425 degrees for 15 to 20 minutes or until topping is puffed and golden and fish flakes easily with a fork., Garnish with dill and lemon if desired.",4.0,International,476
477,Baked Crabmeat,30,"Using a nonstick skillet, coat with cooking spray and place over medium-high  heat until hot., Add chopped pepper and celery and saute until tender; approx.  5  minutes., Remove from heat and add parsley, mustard, ground pepper and hot sauce & stir well., In a separate bowl, beat eggs lightly and combine with mayonnaise;  stir with wire whisk until smooth., Add celery mixture and crabmeat; stirring  gently., Divide into individual baking cups and place on baking sheet. Bake at  375 degrees for 15 to 20 minutes.
",8.0,International,477
478,Grape-Nuts Pie,30,"Combine grapenuts and warm water., Let stand until water is absorbed., Combine beaten eggs with all ingredients except pie shell., Fold in grapenuts., Spoon into pie shell., Bake at 350 for 50 minutes.",4.0,International,478
479,Greek Lentil & Olive Salad,30,"In large bowl, whisk together oil, lemon juice, anchovy paste and pepper., Stir in lentils, olives and oregano., Cover and let stand for 1 hour., (Salad can be refrigerated in airtight container for up to 8 hours; let stand at room temperature for 30 minutes. Makes 2 cups (500 mL.",2.0,International,479
480,Greek Low-Fat Red Pepper Feta Dip,30,"Place peppers on greased grill over medium-high heat; close lid and cook, turning often, for 15 to 20 minutes or until charred., Let cool; peel and seed., In blender or food processor, puree together peppers, feta cheese, vinegar, sugar and cayenne., (Dip can be refrigerated in airtight container for up to 5 days; let stand at room temperature for 30 minutes..",4.0,International,480
481,Greek Salad Dressing,30,"Place all ingredients in a jar, seal tightly and shake well.",2.0,International,481
482,Corn Dogs,30,"Combine cornmeal, flour, baking powder, salt and egg; mix well., Stir in milk to make a thick batter; place in a tall narrow glass. Let stand 4 minutes to thicken., Meanwhile, heat oil to 375 degrees F., Pat hot dogs dry. Dust with flour if desired. Insert sticks in hot dogs; dip into batter. Let excess drip off., Fry until golden brown, about 5-6 minutes. (I've found it works best to fry them one at a time. Unless you have a fryer that is big enough to handle more without them touching.., 
Drain on paper towel.",4.0,International,482
483,Corn Fritters,30,"Mix the dry ingredients, gradually adding the milk and well beaten egg., Beat thoroughly and then add the melted butter and corn., Drop by spoonfuls into hot deep fat and fry until well browned., Drain on brown paper.",2.0,International,483
484,Fresh Crab Cocktail,30,"Combine all ingredients by hand and chill thoroughly., Crab Cocktail  2 whole fresh Dugeness crab, cleaned and cracked  Shredded fresh icebury lettuce  2 fresh lemons, quartered  Line a serving bowl with the shredded lettuce. Arrange a cracked  crab attractively on top of lettuce and garnish with lemon quarters., Serve cocktail sauce in separate bowl., Serves 4  a  list for those seeking a lost favorite or family recipe",4.0,International,484
485,Bacon-Swiss Tossed Salad,30,"In a small bowl, combine mayonnaise, sugar, salt and pepper., In a large salad bowl, layer a third of the greens and a third of the mayonnaise mixture, onion, peas and cheese., Repeat the layers twice., Cover and refrigerate for at least 2 hours., Just before serving, add the bacon and toss.",4.0,International,485
486,Fried Cornbread,30,"Mix cornmeal and salt together in large mixing bowl., Pour approximately 2 cups boiling water over dry ingredients., Mix well., After the mixture cools slightly, shape mixture into balls about the size of golfballs, one at a time.  You must wet your hands with water before you make each ball., Flatten the ball with your fingers., Fry in skillet (preferably cast iron with about 1/2 inch of hot oil., Fry until golden brown on both sides., Delicious!",4.0,International,486
487,Fried Green Tomatoes,30,"Sprinkle sliced tomatoes with sugar, let stand about 15 minutes., Combine flour, salt and pepper and coat tomato slices., Melt 2 tbsp  butter in skillet., Brown  tomatoes  slowly on both sides., Remove each batch to oven proof platter and  keep in oven until all tomatoes are cooked., Add more butter if needed., For  crisp slices, serve as is., Or add 1/2 cup light cream or dairy half and half to skillet. Heat, stirring into drippings, and pour over tomatoes.",6.0,International,487
488,Fried Yellow Squash,30,"Soak squash in buttermilk to cover, at least 5 minutes., Mix dry ingredients together., Dredge marinated squash in cornmeal mixture (I use a Ziploc baggie & shake until covered., Fry in  vegetable oil until golden, turn and fry until lightly golden on other side., Salt lightly, remove from oil, & drain on paper towels., This is delicious - also  works for fried green tomatoes (cut green tomatoes at least 1/4\ slices., If you like fried okra - batter should be 1 cup milk + 1 egg., 
Dredge in same mixture  as above & salt as you do for squash & drain on paper towels.",4.0,International,488
489,Frozen White Truffles,30,"Scoop ice cream into 6 balls; place onto a small cookie sheet or a 9\ pie pan., Freeze until very firm., Quickly roll firm ice cream balls in grated white  chocolate; press in gently., Serve immediately or place on a foil lined cookie  sheet and freeze until serving time.  To serve, in some bowl, combine coffee and liqueur., Divide coffee mixture into 6 small bowls., Place 1 ice cream ball in  each dish.",6.0,International,489
490,Baked Apple Slices,30,"Cut apples into 8 or 12 slices each (like quarters., toss in bowl with sugar and cinnamon, then toss in the melted butter. put in baking dish and bake at 425 basting every 10 min until done. Slices will be tender but will hold their shape.",8.0,International,490
491,Fruit Salad,30,"Dip chopped banana pieces in pineapple juice to keep them from turning too brown., Drain and discard pineapple juice., Mix  fruits, nuts, cream cheese and sugar in bowl., Fold  in whipped topping., Spread  in 9 x 13-inch pan., Freeze  until firm.",15.0,International,491
492,Garam Masala,30,"Preheat oven to 200., Spread the cinnamon, cardamom, cloves, cumin, coriander  and peppercorns in one layer in a large shallow roasting pan., Roast on the  bottom shelf of the oven for 30 minutes, stirring and turning the mixture 2 or 3 times with a large wooden spoon., Do not let the spices brown., Break open the cardamom pods between your fingers or place them one at time on a flat surface and press down on the pod with the ball of your thumb to snap it  open., Pull the pod away from the seeds inside and discard it.  Set the seeds  aside.  Place the roasted cinamon sticks between the 2 layers of a folded linen  towel and pound them with a rolling pin or a kitchen mallet until they are  finely crushed., 
Combine the cardamom seeds, crushed cinnamon, cloves, cumin seeds, coriander  seeds and peppercorns in a small pan or bowl and stir them together until they  are well mixed., Grind the spices a cup or so at a time by pouring them into the jar of an electric blender and blending at high speed for 2 or 3 minutes, until  they are completely pulverized and become a smooth powder., If the machine clogs and stops, turn it off, stir the spices once or twice, then continue blending., As each cupful of the spices is grounded, transfer it to a jar or bottle with a  tightly fitting lid., 
Garam Masala may be stored at room temperature in an airtight container, and  will retain its full flavor for 5 to 6 months.",1.0,International,492
493,Garlic Meatballs in Lemon Sauce,30,"LEMON SAUCE: 8 oz can tomato sauce grated rind of 2 lemons 1/4 cup lemon juice salt and pepper to taste 1 Tbsp minced mint Combine all ingredients for the meatballs and form into walnut-sized balls., Place in crockpot.  Mix the sauce ingredients together and pour over the meatballs., Cover and cook on LOW 4 - 6 hours., Serve with rice.",4.0,International,493
494,Garlic Mushroom Sauce,30,"Crushed garlic, peel and chop finely., Wipe mushrooms and slice finely., Melt butter in a saucepan and add garlic and mushrooms., Cook 2 minutes., Add the red wine and peppercorns., Bring to the boil and simmer 3 - 4 minute.  Stir in the sour cream and salt.  Drizzle sauce over chicken or steaks., Cheers,  Doreen Doreen Randal,  Wanganui., New Zealand.",4.0,International,494
495,Garlic Potato Balls,30,"In a skillet, melt butter over medium heat., Add potatoes and sprinkle with garlic salt., Cook and stir for 15-18 minutes or until golden brown., Garnish with parsley.",2.0,International,495
496,German Onion Cake,30,"In medium skillet, saute the onions in butter over low heat until they just begin to brown, about 15 minutes., Season with 1/4 tsp of the salt, the marjoram and the pepper., Set aside to cool., Preheat oven to 450°F., In a food processor bowl place flour, cornstarch, baking powder, and the remaining salt; mix., Add the shortening and process just until it is the texture of soft crumbs., Add the milk and mix quickly to form a soft dough., Oil a 10 inch round cake pan and lightly use your fingers to spread the dough out evenly., 
Spread the cooked onion over the top., Beat the egg and sour cream together., Spoon the mixture over the onion, and spread it out to the very edge of the pan., Sprinkle lightly with poppy seeds and paprika., Bake for 20 minutes., Let cool slightly, then cut into wedges.",8.0,International,496
497,"Corn, Onion and Corn Rolls",30,"Mix 1 can reduced cream, 1 pkt onion soup mix, and spread about 1 Tbsp over each slice of bread., Roll up and secure with a toothpick. Place on an oven tray,toothpick side down. Brush each roll lightly with melted butter., Bake in pre-heated oven 200 C for 15-20 minutes or until golden brown., Remove toothpicks and cut each roll in half before serving.",4.0,International,497
498,Cornbread and Cheese Muffins,30,"Preheat oven to 400., Lightly spray muffin cups with nonstick cooking spray., In a large bowl, combine cornmeal, flour, baking powder, sugar, and salt; mix well., In a separate bowl, combine egg substitute, creamer, and cottage cheese; blend  until smooth., Using electric mixer, add egg mixture to flour mixture and blend  until smooth., Fold in shredded cheese and let stand 5 minutes at room  temperature.  Fill muffin cups 3/4 full and bake 25 to 30 minutes, until  toothpick inserted in center comes out clean.
",4.0,International,498
499,Bacon and Potato Pie,30,"Trim bacon, chop finely., Peel potatoes and grate.  Peel and chop onion finely, and mix all together., Add flour., Beat eggs and season, add milk., Blend with bacon mixture.  Melt dripping in shallow pan., Pour mixture in ., Bake at 400 F for 3/4 hour., When cooked cut into squares and serve. Cheers, Doreen Doreen Randal,  Wanganui., New Zealand.",4.0,International,499
500,Flake-and-Fruit Squares,30,"Line 9-inch (2.5 L square pan with foil and grease foil., In large bowl, combine cornflakes, sunflower seeds, almonds, sesame seeds, dates and apricots., In large saucepan, melt butter over low heat; stir in marshmallows and heat until melted, stirring constantly., Stir in vanilla., Stir into cornflake mixture until well blended; spoon into prepared pan and pack firmly., Refrigerate until set, about 1 hour., Remove from pan; cut into squares., (Store in airtight container in refrigerator for up to 3 days. Makes 16 squares.
",4.0,International,500
501,Four Treasure Chicken Soup,30,"Mince half of the water chestnuts and combine with chicken, 2 t.sp onions, soy   sauce, mustard and flour., Reserve remaining water chestnuts and onions., In a   large saucepan mix broth, sherry and garlic powder; boil., Drop chicken  mixture  by teaspoonfuls into broth., Add carrots and simmer 3 to 4 minute., until  meatballs  are cooked., Add remaining water chestnuts, green onions and pea  pods., heat  through and serve immediately., From: Lisa Tucker Source: http://soar.Berkeley.edu/recipes.
",4.0,International,501
